,ltable_id,ltable_Beer_Name,ltable_Brew_Factory_Name,ltable_Style,ltable_ABV,rtable_id,rtable_Beer_Name,rtable_Brew_Factory_Name,rtable_Style,rtable_ABV,match,label
0,3917,Honey Basil Amber,Rude Hippo Brewing Company,American Amber / Red Ale,7.40 %,2224,Rude Hippo Honey Basil Amber,18th Street Brewery,Amber Ale,7.40 %,0.9651457667350769,1
1,271,Real McCoy Amber Ale,Mammoth Brewing Company,American Amber / Red Ale,4.50 %,1410,Mammoth Real McCoy Amber Ale,Mammoth Brewing Company,Altbier,4.50 %,0.8433847427368164,1
2,3309,Aqula American Amber Ale,Bier Kaffee Aqula,American Amber / Red Ale,4.50 %,716,Heavy Seas Desert Island Series American Honey Amber Ale,Heavy Seas Brewing Company,Amber Ale,4.90 %,0.0006520035676658154,0
3,1024,Rocket City Red,Straight To Ale,American Amber / Red Ale,5.00 %,37,Sawdust City Red Rocket Coffee Spiced Stout,Sawdust City Brewing Company,Spice/Herb/Vegetable,5.20 %,0.00237968098372221,0
4,1780,Jazz Beer Tarraco Amber,Tarraco Beer,American Amber / Red Ale,6.90 %,685,Jazz Beer Tarraco Amber,Ca l_Arenys - Cervezas Guineu,Amber Ale,6.90 %,0.9493466019630432,1
